{
  "schema_version": "1.0",
  "dataset_version_id": "123e4567-e89b-12d3-a456-426614174000",
  "source_sha256": "aaaaaaaaaaaaaaaaaaaaaaaaaaaaaaaaaaaaaaaaaaaaaaaaaaaaaaaaaaaaaaaa",
  "steps": [
    {
      "op": "trim_whitespace",
      "column": "customer_type",
      "side": "both"
    },
    {
      "op": "replace_values",
      "column": "customer_type",
      "mapping": {
        "Enterprise ": "Enterprise",
        "enterprise": "Enterprise"
      }
    }
  ]
}
